<?xml version="1.0" encoding="UTF-8"?>
<applications-mapping xmlns="http://application.core.maf.j2ee5.seda.com"
	xmlns:xsi="http://www.w3.org/2001/XMLSchema-instance"
	xsi:schemaLocation="http://application.core.maf.j2ee5.seda.com xsd/maf-applications.xsd">
	<default>
		<config-path>/WebContent/applications</config-path>
		<applid>login</applid>
		<ignored-ext>.css .js .jpg .gif .pdf .png .PNG .jks .xml .jsp .properties</ignored-ext>
		<ignored-subcontext>/MetadataPublisherServlet /metadata /AssertionConsumerService /metadataAR /metadataGW /DisplayChart /GetChart /Print /xmla /SingleLogoutService /ext/bolzanoExt</ignored-subcontext>
	</default>
	<security enabled="true">
		<login-page>/login/login.do</login-page>
		<security-error-page>/login/loginerror.do</security-error-page>
		<signon-class>org.seda.payer.manager.login.actions.SignOnSupport</signon-class>
		<sso-class>org.seda.payer.manager.login.actions.SSOSupport</sso-class>
		<after-login>/default/default.do</after-login>
		<locked-timeout>1</locked-timeout> 
		<login-ruleset>
			<username-regex>^[a-zA-Z0-9].{3,50}$</username-regex>
			<password-regex>^[a-zA-Z0-9\.,!#%]{3,15}$</password-regex>
			<attempts>3</attempts> 
			<locked-timeout>1</locked-timeout>
			<msg-invalid>Lo username o la password non sono sintatticamente corrette.</msg-invalid>
			<msg-locked>Il tuo account risulta bloccato. Contatta l'amministratore di sistema.</msg-locked>
			<msg-notfound>Il tuo account non risulta censito.</msg-notfound>
			<msg-notsignedon>Si prega di eseguire il login.</msg-notsignedon>
			<msg-lowprofile>Non ha i requisiti di autorizzazione sufficienti per la sua richiesta.</msg-lowprofile>
			<msg-lowrole>Non ha i requisiti di autorizzazione sufficienti per la sua richiesta.</msg-lowrole>			
		</login-ruleset> 
	</security>
 	
 	<application name="login" protected="false" activate="true">
		<description>Applicazione di Login</description>	
		<config-path>/applications/payer/login</config-path>
		<template-collection>
			<template name="default">maf-templates.xml</template>
			<template name="lepida">maf-templates-lepida.xml</template>
			<template name="soris">maf-templates-soris.xml</template>
			<template name="trentrisc">maf-templates-trentrisc.xml</template>
			<template name="bolzano">maf-templates-bolzano.xml</template>
			<template name="aosta">maf-templates-aosta.xml</template>
			<template name="maggioli">maf-templates-maggioli.xml</template>
			<template name="sassari">maf-templates-sassari.xml</template>
			<template name="consbonrm">maf-templates-consbonrm.xml</template>
			<template name="sap">maf-templates-sap.xml</template>
			<template name="padanatech">maf-templates-padanatech.xml</template>
			<template name="fccsa">maf-templates-fccsa.xml</template>
			<template name="cbec">maf-templates-cbec.xml</template>
			<template name="provroma">maf-templates-provroma.xml</template>
			<template name="serc">maf-templates-serc.xml</template>
			<template name="regabruzzo">maf-templates-regabruzzo.xml</template>
			<template name="roseto">maf-templates-roseto.xml</template>
			<template name="creset">maf-templates-creset.xml</template>
            <template name="regmarche">maf-templates-regmarche.xml</template>
            <!--PG200400-->
			<template name="newsoris">maf-templates-soris.xml</template>
			<!--FINE PG200400-->  
		</template-collection>
		<subcontext>/login</subcontext>
		<welcome>login.do</welcome>
	</application>
 	
 	<application name="default" protected="true" activate="true">
 		<profile-collection>
			<profile>AMMI</profile>
			<profile>AMSO</profile>
			<profile>AMUT</profile>
			<profile>AMEN</profile>
			<profile>PROF</profile>
			<profile>OPER</profile>
		</profile-collection>
		<description>Applicazione di default per la gestione del men√π</description>	
		<config-path>/applications/payer/default</config-path>
		<template-collection>
			<template name="default">maf-templates.xml</template>
			<template name="lepida">maf-templates-lepida.xml</template>
			<template name="soris">maf-templates-soris.xml</template>
			<template name="trentrisc">maf-templates-trentrisc.xml</template>
			<template name="bolzano">maf-templates-bolzano.xml</template>
			<template name="aosta">maf-templates-aosta.xml</template>
			<template name="maggioli">maf-templates-maggioli.xml</template>
			<template name="sassari">maf-templates-sassari.xml</template>
			<template name="consbonrm">maf-templates-consbonrm.xml</template>
			<template name="sap">maf-templates-sap.xml</template>
			<template name="padanatech">maf-templates-padanatech.xml</template>
			<template name="fccsa">maf-templates-fccsa.xml</template>
			<template name="regabruzzo">maf-templates-regabruzzo.xml</template>
			<template name="roseto">maf-templates-roseto.xml</template>
			<template name="cbec">maf-templates-cbec.xml</template>
			<template name="provroma">maf-templates-provroma.xml</template>
			<template name="serc">maf-templates-serc.xml</template>
			<template name="creset">maf-templates-creset.xml</template>
            <template name="regmarche">maf-templates-regmarche.xml</template>
            <!--PG200400-->
			<template name="newsoris">maf-templates-soris.xml</template>
			<!--FINE PG200400-->  
		</template-collection>
		<subcontext>/default</subcontext>
		<welcome>default.do</welcome>
		<starter-class>org.seda.payer.manager.components.config.ManagerStarter</starter-class>
		<binder-class>org.seda.payer.manager.components.config.Binder</binder-class>
		<session-class>org.seda.payer.manager.components.listeners.SessionHandler</session-class>
	</application>

	<application name="entrate" protected="true" activate="true">
		<profile-collection>
		<profile>AMMI</profile>
		<profile>AMSO</profile>
		<profile>AMUT</profile>
		<profile>AMEN</profile>
		</profile-collection>
		<description>Entrate</description>
		<config-path>/applications/payer/entrate</config-path>
		<template-collection>
			<template name="default">maf-templates.xml</template>
			<template name="lepida">maf-templates-lepida.xml</template>
			<template name="aosta">maf-templates-aosta.xml</template>
			<template name="maggioli">maf-templates-maggioli.xml</template>
			<template name="sassari">maf-templates-sassari.xml</template>
			<template name="consbonrm">maf-templates-consbonrm.xml</template>
			<template name="sap">maf-templates-sap.xml</template>
			<template name="fccsa">maf-templates-fccsa.xml</template>
			<template name="regabruzzo">maf-templates-regabruzzo.xml</template>
			<template name="roseto">maf-templates-roseto.xml</template>
			<template name="padanatech">maf-templates-padanatech.xml</template>
			<template name="creset">maf-templates-creset.xml</template>
            <template name="regmarche">maf-templates-regmarche.xml</template>  
		</template-collection>
		<subcontext>/entrate</subcontext>
		<welcome>ricercaAnagrafiche.do</welcome>
		<binder-class>org.seda.payer.manager.components.config.Binder</binder-class>
	</application>

	<application name="ruoli" protected="true" activate="true">
		<profile-collection>
		<profile>AMMI</profile>
		<profile>AMSO</profile>
		<profile>AMUT</profile>
		<profile>AMEN</profile>
		</profile-collection>
		<description>Ruoli</description>
		<config-path>/applications/payer/ruoli</config-path>
		<template-collection>
			<template name="default">maf-templates.xml</template>
			<template name="lepida">maf-templates-lepida.xml</template>
			<template name="consbonrm">maf-templates-consbonrm.xml</template>
			<template name="sap">maf-templates-sap.xml</template>
			<template name="padanatech">maf-templates-padanatech.xml</template>
			<template name="fccsa">maf-templates-fccsa.xml</template>
			<template name="regabruzzo">maf-templates-regabruzzo.xml</template>
			<template name="roseto">maf-templates-roseto.xml</template>
			<template name="creset">maf-templates-creset.xml</template>
            <template name="regmarche">maf-templates-regmarche.xml</template>  
		</template-collection>
		<subcontext>/ruoli</subcontext>
		<welcome>ricercaAnagrafiche.do</welcome>
		<binder-class>org.seda.payer.manager.components.config.Binder</binder-class>
	</application>


	<application name="monitoraggio" protected="true" activate="true">
		<profile-collection>
			<profile>AMMI</profile>
			<profile>AMSO</profile>
			<profile>AMUT</profile>
			<profile>AMEN</profile>
		</profile-collection>
		<description>Monitoraggio transazioni</description>
		<config-path>/applications/payer/monitoraggio</config-path>
		<template-collection>
			<template name="default">maf-templates.xml</template>
			<template name="lepida">maf-templates-lepida.xml</template>
			<template name="trentrisc">maf-templates-trentrisc.xml</template>
			<template name="bolzano">maf-templates-bolzano.xml</template>
			<template name="aosta">maf-templates-aosta.xml</template>
			<template name="maggioli">maf-templates-maggioli.xml</template>
			<template name="sassari">maf-templates-sassari.xml</template>
			<template name="consbonrm">maf-templates-consbonrm.xml</template>
			<template name="sap">maf-templates-sap.xml</template>
			<template name="padanatech">maf-templates-padanatech.xml</template>
			<template name="fccsa">maf-templates-fccsa.xml</template>
			<template name="regabruzzo">maf-templates-regabruzzo.xml</template>
			<template name="roseto">maf-templates-roseto.xml</template>
			<template name="cbec">maf-templates-cbec.xml</template>
			<template name="provroma">maf-templates-provroma.xml</template>
			<template name="serc">maf-templates-serc.xml</template>
			<template name="soris">maf-templates-soris.xml</template>
			<template name="creset">maf-templates-creset.xml</template>
            <template name="regmarche">maf-templates-regmarche.xml</template>  
            <!--PG200400-->
			<template name="newsoris">maf-templates-soris.xml</template>
			<!--FINE PG200400-->
		</template-collection>
		<subcontext>/monitoraggio</subcontext>
		<welcome>monitoraggioTransazioni.do</welcome>